{
  "event": "recording.registered",
  "delivery": "01J8ZCK6R3M8QWX2VN5TKB7PD4",
  "occurred_at": "2026-08-28T21:47:02.334Z",
  "node": "origin-atl-01",
  "node_role": "origin",
  "contract_version": 1,
  "stream": "show-2041-main",
  "session": "01J8ZC8XKWQ4M7T0K3PZ2B9RVN",
  "recording_id": "01J8ZCK5M2V8QNX4RW7TKB3PD9",
  "artifact": "ingest",
  "state": "registered",
  "destination": "/mnt/archive/ingest/show-2041-main/01J8ZC8XKWQ4M7T0K3PZ2B9RVN-ingest-0.ts",
  "container": "mpegts",
  "bytes": 21493022208,
  "dropped_bytes_total": 41943040,
  "duration_seconds": 9138.6,
  "checksum_sha256": "9f2c1d5e6a7b8c9d0e1f2a3b4c5d6e7f8091a2b3c4d5e6f708192a3b4c5d6e7f",
  "local_path": "/var/lib/tmesis/recordings/show-2041-main/01J8ZC8XKWQ4M7T0K3PZ2B9RVN-ingest-0.ts",
  "generation": "01J8ZCK5R7V2QNX8RW4TKB6PD3",
  "registered_at": "2026-08-28T21:47:02.334Z",
  "retention_expires_at": "2026-08-31T21:47:02.334Z",
  "labels": {
    "show_id": "2041",
    "site": "csn"
  },
  "source_generations": []
}
